{
  "task": "T-015",
  "version": 1,
  "step": "s2",
  "outcome": "success",
  "evidence": [
    "go test ./y/...: ok",
    "curl -X POST http://localhost/y: 200"
  ],
  "findings": [
    {
      "agent": "worker-medium",
      "session": "ses_01J8Z8E5F6G7H8J9K0L1M2N3P4",
      "title": "10k warnings/min in service A",
      "where": "repo-a/src/y/log.go:42",
      "why": "masks real errors and inflates log cost"
    }
  ],
  "questions": []
}
